<?xml version="1.0" encoding="UTF-8"?>
<universidad xmlns:xsi="http://www.w3.org/2001/XMLSchema-instance" xsi:noNamespaceSchemaLocation="file:/C:/1-DAM/Lenguajes%20de%20Marcas/Repaso_Examen_XML_XPath/Universidad.xsd">
  <alumno id="A1">
    <nombre>Laura</nombre>
    <edad>21</edad>
    <nota media="10">8.75</nota>
  </alumno>
  <alumno id="A2">
    <nombre>Carlos</nombre>
    <edad>19</edad>
    <nota media="20">6.50</nota>
  </alumno>
</universidad>